{
  "schema_version": "1",
  "artifact_type": "plan-file",
  "plan_id": "FS0-CORE-PLAN",
  "file_change": {
    "path": "repo/planning/conformance-report.schema.json",
    "operation": "create",
    "purpose": "Define the minimum durable machine-readable Conformance evidence used by Core acceptance decisions.",
    "requirement_ids": [
      "FS0-NR-114",
      "FS0-NR-116",
      "FS0-NR-117",
      "FS0-NR-140",
      "FS0-NR-141",
      "FS0-NR-142",
      "FS0-NR-143",
      "FS0-NR-145",
      "FS0-NR-146",
      "FS0-NR-147",
      "FS0-NR-182",
      "FS0-NR-209",
      "FS0-NR-183",
      "FS0-NR-185",
      "FS0-NR-186"
    ],
    "implementation": [
      "Define Draft 2020-12 JSON schema for stable report identity, subject type and identity, PASS/FAIL disposition, evidence references, and deterministic mechanical findings.",
      "Each finding records a machine-oriented code, diagnostic message, and optional repository-relative path.",
      "Forbid fields that purport to create or amend normative semantics; Conformance evidence remains mechanical and non-authoritative.",
      "Do not require deferred mature check registries or independent exact-revision fields when evidence references establish the mechanically evaluated subject."
    ],
    "depends_on_paths": [],
    "generated_consequences": [],
    "validation_ids": [
      "VAL-006",
      "VAL-010",
      "VAL-011"
    ]
  }
}
