{
  "schema_version": "1",
  "artifact_type": "plan-file",
  "plan_id": "FS0-CORE-PLAN",
  "file_change": {
    "path": "repo/tests/fs0_core/test_planning.py",
    "operation": "create",
    "purpose": "Verify functional-set, normative, Plan, Planning Assurance, and executability rules.",
    "requirement_ids": [
      "FS0-NR-013",
      "FS0-NR-014",
      "FS0-NR-015",
      "FS0-NR-016",
      "FS0-NR-017",
      "FS0-NR-018",
      "FS0-NR-019",
      "FS0-NR-020",
      "FS0-NR-021",
      "FS0-NR-022",
      "FS0-NR-023",
      "FS0-NR-024",
      "FS0-NR-025",
      "FS0-NR-026",
      "FS0-NR-027",
      "FS0-NR-028",
      "FS0-NR-029",
      "FS0-NR-030",
      "FS0-NR-031",
      "FS0-NR-032",
      "FS0-NR-071",
      "FS0-NR-072",
      "FS0-NR-073",
      "FS0-NR-074",
      "FS0-NR-075",
      "FS0-NR-201",
      "FS0-NR-076",
      "FS0-NR-077",
      "FS0-NR-078",
      "FS0-NR-079",
      "FS0-NR-080",
      "FS0-NR-081",
      "FS0-NR-082",
      "FS0-NR-083",
      "FS0-NR-084",
      "FS0-NR-085",
      "FS0-NR-086",
      "FS0-NR-087",
      "FS0-NR-088",
      "FS0-NR-089",
      "FS0-NR-090",
      "FS0-NR-091",
      "FS0-NR-092",
      "FS0-NR-097",
      "FS0-NR-130",
      "FS0-NR-131",
      "FS0-NR-132",
      "FS0-NR-204",
      "FS0-NR-133",
      "FS0-NR-134",
      "FS0-NR-205",
      "FS0-NR-135",
      "FS0-NR-206",
      "FS0-NR-136",
      "FS0-NR-161",
      "FS0-NR-162",
      "FS0-NR-163",
      "FS0-NR-164",
      "FS0-NR-165",
      "FS0-NR-166",
      "FS0-NR-167",
      "FS0-NR-168",
      "FS0-NR-169",
      "FS0-NR-170",
      "FS0-NR-171",
      "FS0-NR-172",
      "FS0-NR-173",
      "FS0-NR-174",
      "FS0-NR-175",
      "FS0-NR-176",
      "FS0-NR-207",
      "FS0-NR-177",
      "FS0-NR-178",
      "FS0-NR-179",
      "FS0-NR-208",
      "FS0-NR-180",
      "FS0-NR-181",
      "FS0-NR-033",
      "FS0-NR-034",
      "FS0-NR-035",
      "FS0-NR-036",
      "FS0-NR-037",
      "FS0-NR-038",
      "FS0-NR-039",
      "FS0-NR-040",
      "FS0-NR-041",
      "FS0-NR-042",
      "FS0-NR-043",
      "FS0-NR-044",
      "FS0-NR-045",
      "FS0-NR-046",
      "FS0-NR-047",
      "FS0-NR-048",
      "FS0-NR-049",
      "FS0-NR-050",
      "FS0-NR-051",
      "FS0-NR-052",
      "FS0-NR-053",
      "FS0-NR-054",
      "FS0-NR-055",
      "FS0-NR-056",
      "FS0-NR-057",
      "FS0-NR-058",
      "FS0-NR-059",
      "FS0-NR-060",
      "FS0-NR-061",
      "FS0-NR-062",
      "FS0-NR-063",
      "FS0-NR-064",
      "FS0-NR-065",
      "FS0-NR-066",
      "FS0-NR-067",
      "FS0-NR-068",
      "FS0-NR-069",
      "FS0-NR-070",
      "FS0-NR-210",
      "FS0-NR-211",
      "FS0-NR-212",
      "FS0-NR-213",
      "FS0-NR-214",
      "FS0-NR-215",
      "FS0-NR-216",
      "FS0-NR-217",
      "FS0-NR-218",
      "FS0-NR-219",
      "FS0-NR-220",
      "FS0-NR-221",
      "FS0-NR-222",
      "FS0-NR-223",
      "FS0-NR-224",
      "FS0-NR-225",
      "FS0-NR-226",
      "FS0-NR-227",
      "FS0-NR-228",
      "FS0-NR-229",
      "FS0-NR-230",
      "FS0-NR-231",
      "FS0-NR-232",
      "FS0-NR-233",
      "FS0-NR-234",
      "FS0-NR-235",
      "FS0-NR-236",
      "FS0-NR-237",
      "FS0-NR-238",
      "FS0-NR-239",
      "FS0-NR-240",
      "FS0-NR-241",
      "FS0-NR-242",
      "FS0-NR-243",
      "FS0-NR-244",
      "FS0-NR-245",
      "FS0-NR-246",
      "FS0-NR-247",
      "FS0-NR-248",
      "FS0-NR-249",
      "FS0-NR-250",
      "FS0-NR-251",
      "FS0-NR-252",
      "FS0-NR-253",
      "FS0-NR-254",
      "FS0-NR-255"
    ],
    "implementation": [
      "Construct minimal temporary functional-set and Plan artifacts.",
      "Assert core/extension identity rules, scope-only functional-set behavior, normative ID uniqueness, applicability rationale, owner uniqueness, and dependency cycle rejection.",
      "Assert duplicate/conflicting paths, missing implementation steps, unresolved validation IDs, missing dependency paths, and predecessor mismatch fail Plan Conformance.",
      "Assert Planning Assurance requires every semantic criterion before pass.",
      "Assert delegated authority must resolve explicitly, derived primitives without authority provenance fail, and product authority cannot define framework authority.",
      "Assert Design Assurance cannot pass until every required semantic-readiness criterion is explicitly dispositioned.",
      "Assert lifecycle history preserves superseded/withdrawn normative identities and rejects identity reuse.",
      "Construct modular Plan fixtures rooted at plan.json and assert valid complete graph resolution across all six subdocument classes.",
      "Assert missing, duplicate, conflicting, unreachable, unauthorized, path-traversing, and plan_id-mismatched Plan subdocuments fail Plan Conformance independently.",
      "Assert plan.json is treated only as the root manifest and cannot silently supply normative requirements or file realization intent outside referenced subdocuments.",
      "Assert FS0 bootstrap Design Assurance, Planning Conformance, and Planning Assurance may be represented by durable external evidence and that candidate FS0 runtime results cannot self-authorize the creating Plan.",
      "Assert bootstrap Planning schemas are consumable as Planning artifacts without becoming Build realization or changing the declared implementation predecessor."
    ],
    "depends_on_paths": [
      "repo/runtime/repo_spec/functional_set.py",
      "repo/runtime/repo_spec/normative.py",
      "repo/runtime/repo_spec/plan.py",
      "repo/runtime/repo_spec/assurance.py"
    ],
    "validation_ids": [
      "VAL-006"
    ],
    "generated_consequences": []
  }
}
