{
  "schema_version": "1",
  "artifact_type": "plan-file",
  "plan_id": "FS0-CORE-PLAN",
  "file_change": {
    "path": "repo/runtime/repo_spec/normative.py",
    "operation": "create",
    "purpose": "Represent Core Planning-owned normative requirements, Conformance/Assurance applicability, stable authority identities, explicit delegation, and minimal default-deny authorization.",
    "requirement_ids": [
      "FS0-NR-025",
      "FS0-NR-127",
      "FS0-NR-128",
      "FS0-NR-129",
      "FS0-NR-139",
      "FS0-NR-130",
      "FS0-NR-131",
      "FS0-NR-136",
      "FS0-NR-161",
      "FS0-NR-162",
      "FS0-NR-163",
      "FS0-NR-164",
      "FS0-NR-036",
      "FS0-NR-038"
    ],
    "implementation": [
      "Define immutable NormativeRequirement records with stable ID, one normative statement, Conformance disposition, and Assurance disposition.",
      "Validate requirement IDs, uniqueness, applicability values, and required rationale for an explicit none disposition.",
      "Enforce only the mechanically necessary Core normative-force grammar: explicit normative force using accepted SHALL, SHALL NOT, or MAY vocabulary.",
      "Represent stable framework authority identities and explicit delegation edges without inferring authority from implementation or historical state.",
      "Provide default-deny authorization lookup for governed Core state; absence of accepted authority or an explicitly governed extension point is rejection rather than inferred permission.",
      "Defer semantic normative-statement quality, generalized normative lifecycle history, derived/product provenance hardening, and mature validation correspondence to later functional sets."
    ],
    "validation_ids": [
      "VAL-003",
      "VAL-006",
      "VAL-010"
    ],
    "depends_on_paths": [],
    "generated_consequences": []
  }
}
