{
  "schema_version": "1",
  "artifact_type": "plan-file",
  "plan_id": "FS0-CORE-PLAN",
  "file_change": {
    "path": "repo/runtime/repo_spec/cli.py",
    "operation": "create",
    "purpose": "Expose the minimum self-hosting workflow as deterministic command-line entry points for AI and human actors.",
    "requirement_ids": [
      "FS0-NR-013",
      "FS0-NR-015",
      "FS0-NR-079",
      "FS0-NR-080",
      "FS0-NR-081",
      "FS0-NR-082",
      "FS0-NR-093",
      "FS0-NR-094",
      "FS0-NR-095",
      "FS0-NR-096",
      "FS0-NR-098",
      "FS0-NR-099",
      "FS0-NR-114",
      "FS0-NR-116",
      "FS0-NR-117",
      "FS0-NR-118",
      "FS0-NR-119",
      "FS0-NR-120",
      "FS0-NR-145",
      "FS0-NR-146",
      "FS0-NR-147",
      "FS0-NR-194",
      "FS0-NR-195"
    ],
    "implementation": [
      "Provide subcommands: design-check, design-assure, functional-set-check, plan-check, planning-assure, plan-accept, build-open, build-check, build-assure, build-accept, status.",
      "All commands accept explicit repository root and artifact paths; no hidden current-directory authority.",
      "Return nonzero on failed Conformance/Assurance/acceptance and emit deterministic JSON summaries suitable for agent use.",
      "CLI dispatches to domain modules and contains no independent policy semantics."
    ],
    "depends_on_paths": [
      "repo/runtime/repo_spec/design.py",
      "repo/runtime/repo_spec/functional_set.py",
      "repo/runtime/repo_spec/plan.py",
      "repo/runtime/repo_spec/build.py",
      "repo/runtime/repo_spec/governance.py"
    ],
    "validation_ids": [
      "VAL-006",
      "VAL-009",
      "VAL-010"
    ],
    "generated_consequences": []
  }
}
