{
  "schema_version": "1",
  "artifact_type": "plan-file",
  "plan_id": "FS0-CORE-PLAN",
  "file_change": {
    "path": "repo/tests/fs0_core/test_build_governance.py",
    "operation": "create",
    "purpose": "Verify Core Build scope enforcement, basic Conformance/Assurance gating, lineage, non-circular acceptance, default-deny authorization, and state advancement.",
    "requirement_ids": [
      "FS0-NR-093",
      "FS0-NR-094",
      "FS0-NR-095",
      "FS0-NR-096",
      "FS0-NR-098",
      "FS0-NR-099",
      "FS0-NR-100",
      "FS0-NR-101",
      "FS0-NR-102",
      "FS0-NR-103",
      "FS0-NR-104",
      "FS0-NR-105",
      "FS0-NR-106",
      "FS0-NR-107",
      "FS0-NR-108",
      "FS0-NR-109",
      "FS0-NR-110",
      "FS0-NR-111",
      "FS0-NR-112",
      "FS0-NR-113",
      "FS0-NR-114",
      "FS0-NR-116",
      "FS0-NR-117",
      "FS0-NR-118",
      "FS0-NR-119",
      "FS0-NR-120",
      "FS0-NR-126",
      "FS0-NR-127",
      "FS0-NR-128",
      "FS0-NR-129",
      "FS0-NR-137",
      "FS0-NR-138",
      "FS0-NR-139",
      "FS0-NR-140",
      "FS0-NR-141",
      "FS0-NR-142",
      "FS0-NR-143",
      "FS0-NR-144",
      "FS0-NR-145",
      "FS0-NR-146",
      "FS0-NR-147",
      "FS0-NR-130",
      "FS0-NR-131",
      "FS0-NR-136",
      "FS0-NR-151",
      "FS0-NR-152",
      "FS0-NR-153",
      "FS0-NR-154",
      "FS0-NR-155",
      "FS0-NR-156",
      "FS0-NR-158",
      "FS0-NR-160",
      "FS0-NR-161",
      "FS0-NR-162",
      "FS0-NR-163",
      "FS0-NR-164",
      "FS0-NR-182",
      "FS0-NR-209",
      "FS0-NR-183",
      "FS0-NR-185",
      "FS0-NR-186",
      "FS0-NR-187",
      "FS0-NR-188",
      "FS0-NR-189",
      "FS0-NR-190",
      "FS0-NR-191",
      "FS0-NR-193",
      "FS0-NR-194",
      "FS0-NR-195",
      "FS0-NR-252",
      "FS0-NR-253"
    ],
    "implementation": [
      "Open a BuildSession around a minimal accepted Plan and temporary repository.",
      "Assert unauthorized target paths and operations fail immediately.",
      "Assert Build cannot finalize without the mechanical and semantic evidence required by Core.",
      "Assert acceptance cannot self-authorize or arise from incidental repository/platform activity.",
      "Assert successful Build acceptance preserves Core lineage and advances accepted implementation state.",
      "Assert Assurance findings cannot directly mutate normative authority.",
      "Assert governed state with no resolvable accepted authorization or governed extension point is rejected by default.",
      "Assert minimal Conformance reports and Build mutation manifests are identity-bearing and resolvable from acceptance lineage.",
      "Assert Build may start from an authorized Planning-artifact-only descendant of the declared implementation predecessor.",
      "Assert implementation realization cannot be reclassified as Planning-only to bypass predecessor or mutation-scope enforcement.",
      "Do not require rich rejection history, generalized authority-lifecycle mutation, or exhaustive platform-capability hardening in FS0-Core."
    ],
    "depends_on_paths": [
      "repo/runtime/repo_spec/build.py",
      "repo/runtime/repo_spec/governance.py"
    ],
    "validation_ids": [
      "VAL-006"
    ],
    "generated_consequences": []
  }
}
