{
  "schema_version": "1",
  "artifact_type": "plan-file",
  "plan_id": "FS0-CORE-PLAN",
  "file_change": {
    "path": "repo/runtime/repo_spec/conformance.py",
    "operation": "create",
    "purpose": "Provide mechanical Design, functional-set, Plan, and Build Conformance for the self-hosting workflow.",
    "requirement_ids": [
      "FS0-NR-002",
      "FS0-NR-003",
      "FS0-NR-004",
      "FS0-NR-005",
      "FS0-NR-011",
      "FS0-NR-012",
      "FS0-NR-019",
      "FS0-NR-020",
      "FS0-NR-021",
      "FS0-NR-022",
      "FS0-NR-023",
      "FS0-NR-024",
      "FS0-NR-079",
      "FS0-NR-080",
      "FS0-NR-081",
      "FS0-NR-108",
      "FS0-NR-114",
      "FS0-NR-115",
      "FS0-NR-116",
      "FS0-NR-117",
      "FS0-NR-118",
      "FS0-NR-119",
      "FS0-NR-127",
      "FS0-NR-128",
      "FS0-NR-129",
      "FS0-NR-203",
      "FS0-NR-130",
      "FS0-NR-131",
      "FS0-NR-132",
      "FS0-NR-204",
      "FS0-NR-133",
      "FS0-NR-136",
      "FS0-NR-152",
      "FS0-NR-153",
      "FS0-NR-154",
      "FS0-NR-155",
      "FS0-NR-161",
      "FS0-NR-162",
      "FS0-NR-163",
      "FS0-NR-182",
      "FS0-NR-209",
      "FS0-NR-183",
      "FS0-NR-184",
      "FS0-NR-185",
      "FS0-NR-186",
      "FS0-NR-187",
      "FS0-NR-188",
      "FS0-NR-189",
      "FS0-NR-190",
      "FS0-NR-191",
      "FS0-NR-192",
      "FS0-NR-193",
      "FS0-NR-036",
      "FS0-NR-038",
      "FS0-NR-039",
      "FS0-NR-051",
      "FS0-NR-053",
      "FS0-NR-054",
      "FS0-NR-055",
      "FS0-NR-056",
      "FS0-NR-057",
      "FS0-NR-058",
      "FS0-NR-059",
      "FS0-NR-060",
      "FS0-NR-065",
      "FS0-NR-212",
      "FS0-NR-213",
      "FS0-NR-214",
      "FS0-NR-215",
      "FS0-NR-222",
      "FS0-NR-223",
      "FS0-NR-224",
      "FS0-NR-225",
      "FS0-NR-226",
      "FS0-NR-228",
      "FS0-NR-229",
      "FS0-NR-230",
      "FS0-NR-231",
      "FS0-NR-232"
    ],
    "implementation": [
      "Expose conformance entry points for design, functional-set, plan, and build subjects.",
      "Design Conformance delegates structural checks to design.py.",
      "Functional-set Conformance delegates scope and reference checks to functional_set.py.",
      "Plan Conformance delegates schema, identity, path, dependency, and executability checks to plan.py.",
      "Build Conformance compares actual mutation manifest to accepted Plan paths, validates generated consequences, executes applicable syntax/parse/compile commands, executes Plan validation commands, repository validation, and end-to-end operational checks.",
      "Produce structured mechanical findings only; never create or amend semantics.",
      "Serialize each Conformance execution to a conformance-report.schema.json-valid report with stable identity and subject/evidence references.",
      "Mechanically enforce default-deny governed-state authorization where authorization relationships are structurally resolvable.",
      "Validate Build mutation manifests against build-manifest.schema.json and accepted Plan scope."
    ],
    "depends_on_paths": [
      "repo/runtime/repo_spec/design.py",
      "repo/runtime/repo_spec/functional_set.py",
      "repo/runtime/repo_spec/plan.py",
      "repo/runtime/repo_spec/repository.py"
    ],
    "validation_ids": [
      "VAL-006",
      "VAL-008",
      "VAL-010"
    ],
    "generated_consequences": []
  }
}
