{
  "schema_version": "1",
  "artifact_type": "plan-file",
  "plan_id": "FS0-CORE-PLAN",
  "file_change": {
    "path": "repo/runtime/repo_spec/normative.py",
    "operation": "create",
    "purpose": "Represent Core Planning-owned normative requirements, Conformance/Assurance applicability, stable authority identities, explicit delegation, and minimal default-deny authorization.",
    "requirement_ids": [
      "FS0-NR-025",
      "FS0-NR-127",
      "FS0-NR-128",
      "FS0-NR-129",
      "FS0-NR-138",
      "FS0-NR-139",
      "FS0-NR-130",
      "FS0-NR-131",
      "FS0-NR-136",
      "FS0-NR-161",
      "FS0-NR-162",
      "FS0-NR-163",
      "FS0-NR-164",
      "FS0-NR-033",
      "FS0-NR-034",
      "FS0-NR-035",
      "FS0-NR-036",
      "FS0-NR-037",
      "FS0-NR-038",
      "FS0-NR-039"
    ],
    "implementation": [
      "Define immutable NormativeRequirement records with stable ID, one normative statement, Conformance disposition, and Assurance disposition.",
      "Validate requirement IDs, uniqueness, applicability values, and required rationale for an explicit none disposition.",
      "Enforce the Core normative-statement grammar selected for FS0: one independently governable rule, self-contained subject/force/behavior, and accepted SHALL/SHALL NOT/MAY force vocabulary.",
      "Represent stable framework authority identities and explicit delegation edges without inferring authority from implementation or historical state.",
      "Provide default-deny authorization lookup for governed Core state; absence of accepted authority or an explicitly governed extension point is rejection rather than inferred permission.",
      "Do not implement generalized normative amendment/supersession/withdrawal history, derived-primitive provenance registries, product-authority hardening, or mature semantic NR-quality automation in FS0-Core."
    ],
    "validation_ids": [
      "VAL-003",
      "VAL-006",
      "VAL-010"
    ],
    "depends_on_paths": [],
    "generated_consequences": []
  }
}
