{
  "schema_version": "1",
  "artifact_type": "plan-file",
  "plan_id": "FS0-CORE-PLAN",
  "file_change": {
    "path": "repo/runtime/repo_spec/assurance.py",
    "operation": "create",
    "purpose": "Provide the minimum governed semantic-review surface needed for Design readiness, Planning acceptance, Build fidelity, bootstrap review evidence, and successor-cycle operation.",
    "requirement_ids": [
      "FS0-NR-082",
      "FS0-NR-100",
      "FS0-NR-101",
      "FS0-NR-102",
      "FS0-NR-103",
      "FS0-NR-104",
      "FS0-NR-109",
      "FS0-NR-110",
      "FS0-NR-111",
      "FS0-NR-112",
      "FS0-NR-113",
      "FS0-NR-120",
      "FS0-NR-127",
      "FS0-NR-128",
      "FS0-NR-129",
      "FS0-NR-137",
      "FS0-NR-172",
      "FS0-NR-255"
    ],
    "implementation": [
      "Define AssuranceFinding and AssuranceReport records with phase, governed subject identity, disposition, rationale, and evidence references.",
      "Support Design, Planning, and Build review phases without encoding mature per-requirement correspondence or detailed review-rubric machinery.",
      "Require a governed semantic review result before an acceptance gate when the applicable Core requirement requires Assurance.",
      "Keep Assurance case-specific and non-authoritative: findings do not mutate normative authority and persistent meaning defects route to Design while Planning-intent defects route to Planning.",
      "For successor functional sets, expose maintained Core capability to record and evaluate Design, Planning, and Build semantic review results.",
      "Bootstrap Assurance remains external process authority defined by Design rather than an FS0 runtime implementation responsibility."
    ],
    "validation_ids": [
      "VAL-006",
      "VAL-007",
      "VAL-010"
    ],
    "depends_on_paths": [],
    "generated_consequences": []
  }
}
