{
  "schema_version": "1",
  "artifact_type": "plan-file",
  "plan_id": "FS0-CORE-PLAN",
  "file_change": {
    "path": "repo/tests/fs0_core/test_planning.py",
    "operation": "create",
    "purpose": "Verify functional-set, normative, Plan, Planning Assurance, and executability rules.",
    "requirement_ids": [
      "FS0-NR-013",
      "FS0-NR-015",
      "FS0-NR-018",
      "FS0-NR-019",
      "FS0-NR-020",
      "FS0-NR-021",
      "FS0-NR-022",
      "FS0-NR-025",
      "FS0-NR-029",
      "FS0-NR-030",
      "FS0-NR-071",
      "FS0-NR-072",
      "FS0-NR-073",
      "FS0-NR-074",
      "FS0-NR-075",
      "FS0-NR-201",
      "FS0-NR-077",
      "FS0-NR-079",
      "FS0-NR-080",
      "FS0-NR-081",
      "FS0-NR-082",
      "FS0-NR-097",
      "FS0-NR-130",
      "FS0-NR-131",
      "FS0-NR-136",
      "FS0-NR-161",
      "FS0-NR-162",
      "FS0-NR-163",
      "FS0-NR-164",
      "FS0-NR-172",
      "FS0-NR-036",
      "FS0-NR-038",
      "FS0-NR-210",
      "FS0-NR-211",
      "FS0-NR-212",
      "FS0-NR-215",
      "FS0-NR-216",
      "FS0-NR-217",
      "FS0-NR-218",
      "FS0-NR-219",
      "FS0-NR-220",
      "FS0-NR-221",
      "FS0-NR-222",
      "FS0-NR-223",
      "FS0-NR-224",
      "FS0-NR-225",
      "FS0-NR-226",
      "FS0-NR-254",
      "FS0-NR-255"
    ],
    "implementation": [
      "Construct minimal temporary Design, functional-set, and modular Plan artifacts.",
      "Assert Core identity rules, exact Design revision binding, scope-only functional-set behavior, normative ID uniqueness, normative-force grammar, and Conformance/Assurance applicability rationale.",
      "Assert duplicate/conflicting target paths, missing implementation intent, unresolved validation references, missing dependency paths, and predecessor mismatch fail Plan Conformance.",
      "Construct modular Plan fixtures rooted at plan.json and assert complete resolution across all authorized Plan document classes.",
      "Assert governed semantic review is required where Core applicability requires Assurance.",
      "Assert explicit delegation and Core default-deny authorization resolve without implementation/history inference.",
      "Do not test bootstrap-process policy, semantic NR-quality automation, rich completion/generated-consequence metadata, generalized lifecycle mutation, or mature validation correspondence in FS0-Core."
    ],
    "depends_on_paths": [
      "repo/runtime/repo_spec/functional_set.py",
      "repo/runtime/repo_spec/normative.py",
      "repo/runtime/repo_spec/plan.py",
      "repo/runtime/repo_spec/assurance.py"
    ],
    "validation_ids": [
      "VAL-006"
    ],
    "generated_consequences": []
  }
}
