{
  "schema_version": "1",
  "artifact_type": "plan-file",
  "plan_id": "FS0-CORE-PLAN",
  "file_change": {
    "path": "repo/planning/build-manifest.schema.json",
    "operation": "create",
    "purpose": "Define the minimum durable Build mutation evidence required for Plan-scope Conformance and Governance lineage.",
    "requirement_ids": [
      "FS0-NR-098",
      "FS0-NR-099",
      "FS0-NR-108",
      "FS0-NR-140",
      "FS0-NR-141",
      "FS0-NR-142",
      "FS0-NR-143",
      "FS0-NR-187",
      "FS0-NR-188",
      "FS0-NR-189",
      "FS0-NR-190",
      "FS0-NR-191",
      "FS0-NR-193"
    ],
    "implementation": [
      "Define Draft 2020-12 JSON schema for build identity, accepted Plan identity, actor, implementation predecessor, Build-start state, resulting candidate state, and observed mutations.",
      "Each mutation records one unique repository-relative path and observed create, modify, delete, or regenerate operation.",
      "Require repository-relative safe paths and prohibit absolute, parent-traversal, or duplicate path/operation entries.",
      "Do not require generated-consequence relationships or other deferred evidence-orchestration metadata in FS0-Core."
    ],
    "depends_on_paths": [],
    "generated_consequences": [],
    "validation_ids": [
      "VAL-006",
      "VAL-008",
      "VAL-010",
      "VAL-011"
    ]
  }
}
