{
  "schema_version": "1",
  "artifact_type": "plan-file",
  "plan_id": "FS0-CORE-PLAN",
  "file_change": {
    "path": "repo/runtime/repo_spec/governance.py",
    "operation": "create",
    "purpose": "Provide explicit non-circular acceptance, provenance, governed state advancement, and authority boundaries.",
    "requirement_ids": [
      "FS0-NR-093",
      "FS0-NR-094",
      "FS0-NR-095",
      "FS0-NR-096",
      "FS0-NR-126",
      "FS0-NR-127",
      "FS0-NR-128",
      "FS0-NR-129",
      "FS0-NR-203",
      "FS0-NR-137",
      "FS0-NR-138",
      "FS0-NR-139",
      "FS0-NR-140",
      "FS0-NR-141",
      "FS0-NR-142",
      "FS0-NR-143",
      "FS0-NR-144",
      "FS0-NR-145",
      "FS0-NR-146",
      "FS0-NR-147",
      "FS0-NR-130",
      "FS0-NR-131",
      "FS0-NR-132",
      "FS0-NR-204",
      "FS0-NR-133",
      "FS0-NR-134",
      "FS0-NR-205",
      "FS0-NR-135",
      "FS0-NR-206",
      "FS0-NR-136",
      "FS0-NR-148",
      "FS0-NR-149",
      "FS0-NR-150",
      "FS0-NR-151",
      "FS0-NR-152",
      "FS0-NR-153",
      "FS0-NR-154",
      "FS0-NR-155",
      "FS0-NR-156",
      "FS0-NR-157",
      "FS0-NR-158",
      "FS0-NR-159",
      "FS0-NR-160",
      "FS0-NR-161",
      "FS0-NR-162",
      "FS0-NR-163",
      "FS0-NR-164",
      "FS0-NR-165",
      "FS0-NR-166",
      "FS0-NR-167",
      "FS0-NR-168",
      "FS0-NR-169",
      "FS0-NR-170",
      "FS0-NR-171",
      "FS0-NR-182",
      "FS0-NR-209",
      "FS0-NR-183",
      "FS0-NR-184",
      "FS0-NR-185",
      "FS0-NR-186",
      "FS0-NR-187",
      "FS0-NR-188",
      "FS0-NR-189",
      "FS0-NR-190",
      "FS0-NR-191",
      "FS0-NR-192",
      "FS0-NR-193",
      "FS0-NR-194",
      "FS0-NR-195",
      "FS0-NR-196",
      "FS0-NR-197",
      "FS0-NR-198",
      "FS0-NR-199",
      "FS0-NR-200",
      "FS0-NR-210",
      "FS0-NR-226",
      "FS0-NR-227",
      "FS0-NR-236",
      "FS0-NR-237",
      "FS0-NR-247",
      "FS0-NR-248",
      "FS0-NR-249",
      "FS0-NR-250",
      "FS0-NR-251",
      "FS0-NR-252",
      "FS0-NR-253"
    ],
    "implementation": [
      "Define governed artifact identities and acceptance records for Design readiness, Planning acceptance, and Build acceptance.",
      "Require acceptance records to identify subject, actor, decision, predecessor authority, evidence references, and resulting state without deriving authority from incidental Git/platform events.",
      "Reject acceptance prerequisites that depend on authority created only by the candidate acceptance itself.",
      "Record lineage from functional-set Design inputs through Planning normative requirements, accepted Plan revision, Build mutation manifest, Conformance evidence, Assurance evidence, and accepted implementation state.",
      "Enforce keystone separation: Governance consumes Conformance and Assurance evidence but does not perform their judgments.",
      "Advance accepted implementation state only on explicit Build acceptance.",
      "Represent explicit rejection records preserving candidate identity, rejection reason, and provenance; rejection never promotes state.",
      "Represent governed state and authorization scope explicitly and apply default-deny when no accepted authority or governed extension point resolves.",
      "Resolve keystone delegation through explicit accepted authority relationships before permitting governed actions.",
      "Maintain stable identities for Design revisions, Planning work, accepted Plans, Build work, and Build results.",
      "Maintain normative lifecycle history for creation, amendment, supersession, and withdrawal without identity reuse.",
      "Reference durable Conformance reports, Assurance reports, and Build mutation manifests in acceptance lineage.",
      "Accept FS0 bootstrap Design Assurance, Planning Conformance, and Planning Assurance only as durable evidence produced under pre-existing accepted bootstrap authority.",
      "Record bootstrap evidence identities in Planning acceptance lineage without treating candidate FS0 runtime output as a self-authorization prerequisite.",
      "Treat accepted functional-set/Plan schemas and modular Planning documents created before Build as governed Planning artifacts; their presence in the repository does not make them FS0 Build realization.",
      "Permit BuildSession to consume accepted bootstrap Planning artifacts while preserving the Plan-declared pre-Planning implementation predecessor."
    ],
    "depends_on_paths": [
      "repo/runtime/repo_spec/assurance.py",
      "repo/runtime/repo_spec/conformance.py",
      "repo/runtime/repo_spec/plan.py",
      "repo/runtime/repo_spec/repository.py"
    ],
    "validation_ids": [
      "VAL-006",
      "VAL-008",
      "VAL-009",
      "VAL-010"
    ],
    "generated_consequences": []
  }
}
